,0,1
455,"Innovating Skin Cancer Detection with Transfer Learning, Feature Fusion, Efficient Data Management, Data Augmentation and Interdisciplinary Expertise for Better Outcomes",https://osf.io/w5mp9
456,Intention regulates conflicting desires in human decision making,https://osf.io/b53q9
457,Clinical Guidelines vs. Real-World Treatment Data: The Use of Session Summaries,https://osf.io/6btsf
458,On the Implications of Automation in the Manufacture Industry on United States Residing Blue-Collar Workers,https://osf.io/qgexu
459,Meta-Representations as Representations of Processes,https://osf.io/zg27u
460,Clinical Guidelines vs. Real-World Treatment Data: The Use of Session Summaries,https://osf.io/6btsf
461,On the Implications of Automation in the Manufacture Industry on United States Residing Blue-Collar Workers,https://osf.io/qgexu
462,Revolutionizing Ovarian Cancer Care: Innovative Approaches in Research and Treatment,https://osf.io/nqvxz
463,The Ideological Turing Test: a behavioural measure of open-mindedness and perspective-taking,https://osf.io/2e9wn
464,"Towards an Ethics of Autopoietic Technology: Stress, Care, and Intelligence",https://osf.io/pjrd2
465,Deep Learning: Implications for Human Learning and Memory,https://osf.io/3m5sb
466,EMERGING RECOMMENDATIONS FOR INITIAL AUTOMATED TARGET RECOGNITION (ATR) DISPLAY CONSIDERATIONS: Implications for Concept Development and Evaluation,https://osf.io/w9qge
467,Settle Conflicts in the Intelligence Differentiation Area using the Raw Material Conversion (RMC) Intelligence Model Built upon the Systematic Integrated Review (SIR) Paradigm,https://osf.io/fgkqe
